[{"scenario_id":"sidebar-navigation-interaction","mode":"interaction","cases":[{"op":"toggle","active":12,"cue_count":20,"step":10,"duplicate_text":[3,12],"props":{"sub-start":120.2,"time-pos":120.3}},{"op":"manual-scroll","active":10,"cue_count":20,"steps":-3,"next_active":18,"step":1,"props":{},"duplicate_text":null},{"op":"click-seek","active":3,"cue_count":20,"target":7,"step":1,"props":{},"duplicate_text":null}],"expect":[{"open":true,"rows":[8,9,10,11,12,13,14,15,16],"paused":false},{"accepted":true,"held":0,"before_expiry":0,"fired":true,"after":14,"redraws":1},{"captured":true,"time_pos":[7.0],"paused":false}],"given":{"viewport":[1280,720],"panel_rect":[100,100,400,500]}}]
